{
  "schema_version": "1.0",
  "id": "confluence-attachment-att557809766",
  "filename": "Screenshot 2024-10-15 135705.png",
  "media_type": "image/png",
  "size_bytes": 45505,
  "sha256": "a6dc9a010383d8c799282d5c3fe75051e7e2247eabd59ceb604e949200a2de5a",
  "local_path": "pages/557645826/attachments/att557809766-Screenshot 2024-10-15 135705.png",
  "source": {
    "connector": "confluence",
    "external_id": "att557809766",
    "container_external_id": "557645826",
    "url": "https://stretchsense.atlassian.net/pages/viewpageattachments.action?pageId=557645826&preview=%2F557645826%2F557809766%2FScreenshot+2024-10-15+135705.png"
  },
  "status": "available",
  "extensions": {
    "confluence": {
      "version": 1,
      "comment": ""
    }
  }
}
