{
  "schema_version": "1.0",
  "id": "confluence-attachment-att574488691",
  "filename": "51QYAWfuDGL._AC_SX425_.jpg",
  "media_type": "image/jpeg",
  "size_bytes": 13262,
  "sha256": "01fe3d364863e3529b2c25e950c3e7b00741346b7da55f70f8eca783c4f602a5",
  "local_path": "pages/574488598/attachments/att574488691-51QYAWfuDGL._AC_SX425_.jpg",
  "source": {
    "connector": "confluence",
    "external_id": "att574488691",
    "container_external_id": "574488598",
    "url": "https://stretchsense.atlassian.net/pages/viewpageattachments.action?pageId=574488598&preview=%2F574488598%2F574488691%2F51QYAWfuDGL._AC_SX425_.jpg"
  },
  "status": "available",
  "extensions": {
    "confluence": {
      "version": 1,
      "comment": ""
    }
  }
}
