{
  "schema_version": "1.0",
  "id": "confluence-attachment-att509903156",
  "filename": "d-up.png",
  "media_type": "image/png",
  "size_bytes": 3139145,
  "sha256": "c55972db9cd73372875d94356b2efaeee4d728b69663d02f86bdf83875f65483",
  "local_path": "pages/510034021/attachments/att509903156-d-up.png",
  "source": {
    "connector": "confluence",
    "external_id": "att509903156",
    "container_external_id": "510034021",
    "url": "https://stretchsense.atlassian.net/pages/viewpageattachments.action?pageId=510034021&preview=%2F510034021%2F509903156%2Fd-up.png"
  },
  "status": "available",
  "extensions": {
    "confluence": {
      "version": 2,
      "comment": ""
    }
  }
}
