{
  "schema_version": "1.0",
  "id": "confluence-attachment-att509903237",
  "filename": "menu.png",
  "media_type": "image/png",
  "size_bytes": 3647306,
  "sha256": "7101953f8f3832b279b512d3df90945c4213f610bc4fda42c035bb758f63ad9c",
  "local_path": "pages/510034021/attachments/att509903237-menu.png",
  "source": {
    "connector": "confluence",
    "external_id": "att509903237",
    "container_external_id": "510034021",
    "url": "https://stretchsense.atlassian.net/pages/viewpageattachments.action?pageId=510034021&preview=%2F510034021%2F509903237%2Fmenu.png"
  },
  "status": "available",
  "extensions": {
    "confluence": {
      "version": 2,
      "comment": ""
    }
  }
}
