{
  "schema_version": "1.0",
  "id": "confluence-attachment-att509903150",
  "filename": "d-idle.png",
  "media_type": "image/png",
  "size_bytes": 4624779,
  "sha256": "126596c6e98784bceaec132616326ee0e23ca074909d8c70b6439f1e9b54479a",
  "local_path": "pages/510034021/attachments/att509903150-d-idle.png",
  "source": {
    "connector": "confluence",
    "external_id": "att509903150",
    "container_external_id": "510034021",
    "url": "https://stretchsense.atlassian.net/pages/viewpageattachments.action?pageId=510034021&preview=%2F510034021%2F509903150%2Fd-idle.png"
  },
  "status": "available",
  "extensions": {
    "confluence": {
      "version": 4,
      "comment": ""
    }
  }
}
