{
  "schema_version": "1.0",
  "id": "confluence-attachment-att557809724",
  "filename": "Mocute-052-Game-Pad-Gamepad-Pubg-Controller-Mobile-Bluetooth-Joystick-For-iPhone-Android-Smart-TV-Box.jpg_.png",
  "media_type": "image/png",
  "size_bytes": 124899,
  "sha256": "effbd2a982ecbe9a44aa75474be7af7c3f1acac1461565468e72df9d225e74dd",
  "local_path": "pages/557645826/attachments/att557809724-Mocute-052-Game-Pad-Gamepad-Pubg-Controller-Mobile-Bluetooth-Joystick-For-iPhone-Android-Smart-TV-Box.jpg_.png",
  "source": {
    "connector": "confluence",
    "external_id": "att557809724",
    "container_external_id": "557645826",
    "url": "https://stretchsense.atlassian.net/pages/viewpageattachments.action?pageId=557645826&preview=%2F557645826%2F557809724%2FMocute-052-Game-Pad-Gamepad-Pubg-Controller-Mobile-Bluetooth-Joystick-For-iPhone-Android-Smart-TV-Box.jpg_.png"
  },
  "status": "available",
  "extensions": {
    "confluence": {
      "version": 1,
      "comment": ""
    }
  }
}
